Page,Question,Answer
1,What is the purpose of a car insurance policy booklet?,"A car insurance policy booklet provides information about the coverage, terms, and conditions of an insurance policy for a vehicle."
1,What information can be found in a car insurance policy booklet?,"A car insurance policy booklet typically includes details about the insured vehicle, the policyholder, the coverage limits, deductibles, exclusions, and any additional endorsements or riders."
1,Why is it important to keep a car insurance policy booklet in the vehicle?,"Keeping a car insurance policy booklet in the vehicle ensures that the policyholder has easy access to important information in case of an accident or other incident, and can provide it to law enforcement or other parties as needed."
2,What does the policy include?,"The policy includes this booklet, your car insurance details, your certificate(s) of motor insurance, and if applicable, Green Flag breakdown cover and DriveSure terms and conditions."
2,What is the meaning of words in bold type?,"Words in bold type have a specific meaning, such as your car or modifications. You can find the exact meanings of these words in the 'Glossary' on page 4, or at the start of each section."
2,What is Comprehensive with DriveSure?,"Comprehensive with DriveSure is a policy that includes the same cover as a Comprehensive policy, and wherever Comprehensive is mentioned in the policy booklet, it also applies to Comprehensive with DriveSure."
3,How much will you pay if my car is damaged?,"Where damage to your car is covered under your policy, we’ll pay the cost of repairing or replacing your car up to its UK market value. This is the current value of your car at the time of the claim."
3,Who is covered to drive other cars?,"Your certificate of motor insurance will show who has cover to drive other cars. We’ll only cover injury to third parties, or damage caused to their property, not to the car being driven."
3,Am I covered if I leave my car unlocked or the keys in the car?,"We won’t pay a claim for theft or attempted theft if your car is left: Unlocked. With keys or key fobs in, on, or attached to the car. With the engine running. With a window or roof open."
5,What is considered a loss of any limb?,"A limb severed at or above the wrist or ankle, or the total and irrecoverable loss of use of a hand, arm, foot or leg."
5,Who is the main driver?,"The person you declared was the main user of your car, and who’s shown as the main driver on your car insurance details."
5,What is the market value?,"The cost of replacing your car with another of the same make and model, and of a similar age, mileage, and condition at the time of the accident or loss."
6,What is the first step to making a claim?,"To make a claim, you need to provide your personal details, policy number, car registration number, a description of the loss or damage, and the other driver's details if you've been in an accident."
6,What should you do if you receive any communication from a court or a threat of legal action?,"If you receive any communication from a court or a threat of legal action, you should contact your insurance company immediately."
6,When do you have to pay an excess?,You may have to pay an excess if you are at fault for the accident or if your car is stolen from a public place.
7,What are the steps involved in making a claim for repairs or replacements?,"1. Contact your insurance company and report the incident.
2. Get an estimate for the repairs or replacements.
3. Submit the estimate to your insurance company.
4. Your insurance company will review the estimate and approve the repairs or replacements.
5. You can then take your car to a repair shop to have the repairs or replacements done."
7,What are the benefits of using an approved repairer?,"1. You will not need an estimate.
2. You will benefit from our 5-year Guarantee.
3. This means parts, materials and workmanship provided by our approved repairer are guaranteed for five years, unless you sell your car or end your lease."
7,What happens if I use a repairer of my choice?,"1. You must give us full details of the incident.
2. We must approve the repairer’s detailed assessment of the repairs before the work begins.
3. We may then make the arrangements for the repairs ourselves.
4. Those repairs will NOT be guaranteed by us even though we may pay for them directly."
8,"What is the maximum amount of cover for property damage under the Third Party, Fire and Theft Essentials policy?","The maximum amount of cover for property damage under the Third Party, Fire and Theft Essentials policy is £20,000,000 per accident (includes all costs and expenses)."
8,What is the excess for accidental damage claims related to the courtesy car under the Comprehensive policy?,The excess for accidental damage claims related to the courtesy car under the Comprehensive policy is £250.
8,Is a courtesy car included under the Comprehensive Plus policy?,"Yes, a courtesy car is included under the Comprehensive Plus policy if you haven't picked Guaranteed Hire Car Plus."
9,What is covered under accidental damage?,"Accidental damage to your car, child car seat replacement, in-car entertainment fitted in your car when it was made, in-car entertainment fitted in your car after it was made, removable electronic equipment, misfuelling, lost or damaged car keys."
9,What is covered under windscreen damage?,"If you use an approved windscreen supplier, if you choose a different supplier for repairs, if you choose a different supplier for replacement."
9,What personal benefits are covered?,"New car replacement, personal belongings, personal accident, medical expenses, hotel expenses, uninsured driver promise, vandalism promise."
10,"What is the overall limit for all claims, including appeals or counterclaims, to do with the same incident?","The overall limit for all claims, including appeals or counterclaims, to do with the same incident is £100,000."
10,What is the amount of time you can have the car for if you use a different repairer?,The amount of time you can have the car for if you use a different repairer is 21 days.
10,What is the maximum number of claims allowed?,The maximum number of claims allowed is 2 claims in 3 years.
11,What does the insurance cover if you cause an accident?,"The insurance will cover you if you are found legally responsible for an accident involving your car that injures or kills someone, and/or damages someone else’s property."
11,What is included in the coverage if someone needs emergency medical treatment?,The insurance will cover emergency medical treatment if it’s our responsibility under the Road Traffic Act.
11,What is the coverage for other people?,"The insurance will also cover any of the following people for their liability to others: 
- Anyone insured by this policy to drive your car, if they have the policyholder’s permission.
- Anyone that the policyholder allows to use, but not drive, your car.
- Anyone getting into or out of your car.
- The legal representative of anyone covered if that person dies.
- The employer or business partner of anyone covered while your car is being used for business purposes, if your certificate of motor insurance includes business use."
12,Under what circumstances is the main driver covered for liability to others when driving another car?,"The main driver may be covered for liability to others when driving another car if they are not covered by another insurance policy, they do not own the other car or it is not hired to them under a hire-purchase or leasing agreement, the car is not a hire, rental or courtesy car unless we have provided or arranged it, the owner of the car they are driving gives their permission, the car they are driving is registered and being driven within the territorial limits or in the Republic of Ireland, and you still have your car and it hasn't been written off."
12,What are some of the exclusions to coverage under the policy?,"The policy does not cover liability for loss, damage or injury that is covered by another insurance policy, the result of grinding, cutting, welding or soldering operations, or using blow lamps or torches on or in your car, or due to an act of terrorism as defined by the terrorism legislation applicable where the incident took place. The policy also does not cover legal costs or expenses for speeding offences, driving under the influence of alcohol or drugs, or parking offences."
12,What is not covered if you are driving another car?,"If you are driving another car, the policy does not cover any damage, fire or theft to the car you are driving, Motor Legal cover, or liability for loss of, or accidental damage to, any car you are driving or any trailer or vehicle you are towing."
13,Who is covered under the insurance policy?,The policyholder and anyone else insured by this policy to drive your automated car with your permission.
13,Where does the insurance coverage apply?,"Great Britain, which includes England, Scotland, and Wales."
13,What is the insured person's responsibility regarding the car's software?,To keep the software up to date and not modify it other than in accordance with the manufacturer's instructions.
14,"In what circumstances will the insurance policy not cover any loss, damage, or injury?","The insurance policy will not cover any loss, damage, or injury that takes place outside of Great Britain, is caused by the automated car driving itself at any time or place that the use of automated functions is unlawful, to the extent that an accident was caused or contributed to by any party suffering loss, damage, or injury, to an insured person if the accident is caused by a failure to install safety critical updates to the automated car or its software has been altered without the approval of the manufacturer, to the person in charge of the automated car where the accident was wholly due to that person's negligence in allowing the automated car to begin driving itself when it was not appropriate to do so, to property which an insured person owns or is responsible for, that's covered by another insurance policy, that's due to an act of terrorism as defined by the terrorism legislation applicable where the incident took place, to the automated car or trailer, or to goods carried for hire or reward."
14,What is covered under the fire and theft section of the insurance policy?,"The fire and theft section of the insurance policy covers the following: if the car is stolen, damaged as a result of theft or attempted theft, or damaged by fire, lightning, or an explosion."
14,What are the options for the insurance company to settle a claim under the fire and theft section?,"The insurance company can choose to repair the damage, replace whatever is lost or damaged, or repay the claim by sending a payment."
15,What is covered in the event of fire or theft?,"In-car entertainment equipment permanently fitted in your car when it was made or after it was made, and removable electronic equipment."
15,What is not covered in the event of fire or theft?,"Loss or damage to your car if it isn't kept secure, if someone takes it by fraud or deception, if removable electronic equipment or removable in-car entertainment is left inside a locked car where it could be seen, if any property is left in an open or convertible car outside of a locked boot or locked glove compartment, and loss or damage caused by theft or attempted theft of your car if any security device fitted to your car by the manufacturer is not operational when your car is left unattended."
15,How much coverage is provided?,Up to the amounts shown in 'What your cover includes' on page 8.
16,What coverages include stolen car keys?,"Essentials, Comprehensive, and Comprehensive Plus."
16,What steps must be taken to protect car keys from theft?,All reasonable steps must be taken to protect car keys from theft.
16,What is required if car keys are stolen?,"The theft must be reported to the police, and a crime reference number must be provided."
17,What type of car will the courtesy car be?,The courtesy car will be a small hatchback car with an engine size of up to 1000cc.
17,What is the excess if you claim under section 4 for accidental damage?,The excess if you claim under section 4 for accidental damage is £250.
17,Are you covered for a courtesy car if your car is written off or stolen and not recovered?,"No, you are not covered for a courtesy car if your car is written off or stolen and not recovered."
18,What are the options available if your car is accidentally damaged?,"Repair - the insurance company will repair the damage themselves or pay for it to be repaired.
Replace - the insurance company will replace whatever is lost or damaged, if that’s more cost-effective.
Repay - the insurance company will settle your claim by sending a payment."
18,What is included in the cover for child car seats?,"If you have a child car seat fitted to your car and your car is involved in an accident, the insurance company will arrange a replacement, or cover you for the cost of replacing the child car seat with a new one of a similar standard, even if there is no apparent damage. You may be required to provide proof of ownership as part of the claim."
18,What is included in the cover for in-car entertainment fitted in your car when it was made?,"If your car is damaged, the insurance company will also replace any damaged in-car entertainment equipment that was permanently fitted in your car when it was made, as long as they haven’t sent a payment to cover replacing your car."
18,What is included in the cover for in-car entertainment fitted in your car after it was made?,"If your car is damaged, the insurance company will also replace any damaged in-car entertainment equipment that was permanently fitted in your car after it was made, as long as they haven’t sent a payment to cover replacing your car."
18,What is included in the cover for removable electronic equipment?,"If your car is damaged, the insurance company will also replace any damaged removable electronic equipment, as long as they haven’t sent a payment to cover replacing your car."
18,What is included in the cover for misfuelling (using the wrong fuel)?,The insurance company will cover any damage to your car caused by misfuelling.
19,What is covered under the lost or damaged car keys policy?,"The policy covers the repair or replacement of lost or damaged car keys, including any locksmith charges."
19,What steps must the policyholder take to protect their car keys?,The policyholder must take all reasonable steps to protect their car keys from loss or damage.
19,What is not covered under the lost or damaged car keys policy?,"The policy does not cover any reduction in the car's market value due to lost keys or losses that are not directly due to the keys being lost or damaged, such as loss of use or earnings."
20,What is covered under windscreen damage?,"Accidental damage to the windscreen, sunroof, or windows of your car, as well as any scratching to the bodywork caused by the broken glass."
20,How much am I covered for under windscreen damage?,Up to the amounts shown in ‘What your cover includes’ on page 8 of the policy.
20,What is not covered under windscreen damage?,"Any other losses covered under another section of the policy for the same incident, such as dents to the bodywork, or damage caused by vandalism."
21,What are the personal benefits included in your car insurance?,"The personal benefits included in your car insurance are: No Claim Discount protection, medical expenses cover, and personal accident cover."
21,What do you need to provide if you claim for an accident that isn't your fault and the driver of the vehicle that hits your car is uninsured?,"If you claim for an accident that isn't your fault and the driver of the vehicle that hits your car is uninsured, you'll need to provide the registration number, make and model of the vehicle that hit you, the driver's details (if possible), and the names and addresses of any independent witnesses (if available)."
21,What is the maximum amount of cover for personal accident?,The maximum amount of cover for personal accident is up to the amounts shown in 'What your cover includes' on page 8.
22,What conditions must be met to receive new car replacement coverage?,"To receive new car replacement coverage, the following conditions must be met:

1. You must be the first and only registered keeper of the car.
2. If you have Comprehensive cover, your car must be less than 1 year old when it's stolen or damaged.
3. If you have Comprehensive Plus cover, your car must be less than 2 years old when it's stolen or damaged."
22,"What will the insurance company do if your car is stolen and not recovered, or written off?","If your car is stolen and not recovered, or written off, the insurance company will replace it with one of the same make and model."
22,What are the circumstances under which the insurance company will replace your car?,"The insurance company will replace your car if it has:

1. Been reported as stolen to the police and has not been found.
2. Suffered damage that this policy covers, and the cost of repairing it is more than 60% of the last UK list price (including taxes)."
23,What is Motor Legal Cover?,"Motor Legal Cover is a type of insurance that covers the costs of legal action or defense in court. It is included with Comprehensive Plus car insurance and is an optional extra for Third Party, Fire and Theft, Essentials, and Comprehensive car insurance."
23,What are the specific meanings of certain terms used in the context of Motor Legal Cover?,"- Abroad: Anywhere outside of the territorial limits, restricted to the Republic of Ireland and countries listed in ‘Where you can drive’ on page 31.
- Appointed representative: The preferred law firm, solicitor, or other suitably qualified person that we appoint to represent you under this section of the policy.
- Costs: Legal costs, including all reasonable, necessary and proportionate legal fees, expenses and other fees charged by the appointed representative and agreed by us. We’ll assess legal fees, expenses and other fees on the standard basis, or in line with any fixed recoverable costs scheme that applies.
- Court: A court, tribunal or other suitable authority.
- Date of incident: 
>For road traffic accidents – the date the accident happened.
>For motoring offences – the date the alleged offence took place.
>For motor contract disputes – the date the alleged incident took place.
- Preferred law firm: The law firm we choose to provide legal services. We choose these legal specialists as they have the expertise to deal with your claim and comply with our agreed service standards.
- Reasonable chance of succeeding:
>For road traffic accident and motor contract dispute claims: When we and the appointed representative agree that there is a higher than 50% chance that you’ll get a favorable judgment and do either of the following:
>>Recover your losses or damages.
>>Get any other legal remedy we agree to. (For example, an enforcement of judgment, a successful appeal, or a successful defense of an appeal.)
>For motoring offense claims: When we and the appointed representative agree that there’s a higher than 50% chance that you can achieve any of the following:
>>Reduce your sentence or fine.
>>Make a successful appeal.
>>Make a successful defense of an appeal.
- Terms of appointment: A separate contract we make with the appointed representative if they’re not a preferred law firm. It sets out the amounts we will pay the appointed representative and their responsibilities to report to us."
23,What are the conditions for Motor Legal Cover to be provided?,Motor Legal Cover will only be provided if your claim has a reasonable chance of succeeding for the duration of the claim.
24,Who is covered under the policy?,"The policy covers the policyholder, named drivers, the registered keeper of the car, and passengers in the event of a motoring offense or road traffic accident."
24,What services are provided by the policy?,"The policy provides cover for the costs of defending against motoring offenses, pursuing or defending breach of contract claims related to car purchases or services, and claiming uninsured losses from at-fault parties in road traffic accidents."
24,What are the limits of coverage?,"The amount of coverage is specified in 'What your cover includes' on page 8 and includes any applicable VAT. This is the maximum amount payable for all claims, including appeals or counterclaims related to the same incident."
25,What are the things that are not covered by the policy?,"The policy does not cover legal claims for any loss or damage that is already covered by this policy or any other insurance policy, claims that are to do with an incident that happened before your cover started, any costs that we haven’t agreed to, or any costs that relate to the period before we accept your claim, fines, penalties, compensation or damages you’re ordered to pay by a court, any dispute with us under Motor Legal Cover, any appeal or enforcement action, unless we provided cover for the original claim, psychological injuries or mental illness, unless they were caused by something covered by the policy that also caused you physical injury, action against another person insured by this policy, if that person was to blame for the accident."
25,What are the motoring offenses that are not covered by the policy?,"The policy does not cover any offences to do with parking, obstruction or waiting, drink or drugs, vehicle tests, such as the MOT, driving unroadworthy vehicles, driving licences or vehicle documentation."
25,What are the motor contract disputes that are not covered by the policy?,"The policy does not cover any claim if the amount in dispute is less than £250 including VAT, any dispute to do with faults in your car, its spare parts or accessories, if you knew about the faults before buying these items, or before your Motor Legal Cover started, between you and someone you live with or used to live with, with anyone insured by this policy, about a car insurance policy or claim, about the purchase or sale of salvage, about contracts you entered into before your Motor Legal Cover started, for any contracts to do with a profession, business, trade, or any other activity that you’re paid for or that aims to make money, your employment, the sale of your car, its spare parts or accessories, if the person who entered into the contract is not the owner, loans, borrowing or other financial services contracts."
26,What are the conditions for accepting a claim?,"1. The incident must have occurred within the territorial limits, except where covered abroad.
2. The policyholder must have been covered on the date of the incident.
3. The legal proceedings must take place in a court within the territorial limits, except where covered abroad."
26,What are the policy terms that must be followed?,"1. Comply with all of the terms of the policy.
2. Take all reasonable precautions to minimize the cost of claims.
3. Take all reasonable precautions to prevent a claim from happening."
26,What are the consequences of not following the policy terms?,"1. Refusal or withdrawal from the claim.
2. Refusal to cover costs, even if they have already been agreed to.
3. Request for reimbursement of costs that have already been paid."
27,What happens when you refuse to accept an offer or payment that we or your appointed representative think you should accept?,We can refuse to cover any further costs.
27,When might we choose to settle your claim?,We can settle your claim outside of court if we think it makes financial sense to do this.
27,What happens if your costs can be recovered from somewhere else?,"You must tell your appointed representative to do this. If we’ve paid costs that you then recover, you must pay the money back to us."
28,What is Guaranteed Hire Car Plus?,"Guaranteed Hire Car Plus is a service that provides you with a hire car that is similar in size to your own car if your car is damaged in an accident, written off, or stolen."
28,What types of cars are provided as hire cars?,"The type of hire car provided depends on the size of your car. If your car has up to 5 seats, you may be provided with a hire car up to a 4/5 door standard saloon. If your car has 6 or more seats, you may be provided with a hire car up to a Mini MPV."
28,How long am I covered for a hire car?,"The length of time you are covered for a hire car depends on the circumstances. If your car can be repaired and is driveable, you are covered for a hire car from the point your car goes in for repair until it is repaired. If your car can be repaired but is not driveable, you are covered for a hire car for up to 21 days in a row while it is being repaired. If your car is written off or stolen and not recovered, you are covered for a hire car for whichever is shortest of these two periods: up to 21 days in a row or up to 5 days after our first (or only) payment has been issued to settle your claim."
29,What are the circumstances under which the insurance company will provide a hire car?,"The insurance company will provide a hire car if the policyholder is injured and unable to drive, if their car has been adapted for a disabled driver or passenger and a suitable hire car is not available, or if there are no hire cars available."
29,What is the maximum amount the insurance company will pay for travel costs if they cannot provide a hire car?,"The insurance company will pay up to £50 per day for travel costs, up to a total of £500 per claim."
