Page,Question,Answer
29,What are the conditions for using the hire car?,"The hire car may only be used while the policyholder's car is off the road or being repaired as a result of an accident, fire, or theft, and within the territorial limits unless the hire car company gives permission and appropriate insurance cover to use it elsewhere."
30,What is Protected No Claim Discount?,Protected NCD is an optional extra cover that allows the policyholder to protect their No Claim Discount (NCD) in case they make a claim.
30,How does Protected NCD work?,"Once the policyholder has a minimum of four years' worth of NCD, they can protect it by paying an additional premium. This means that they can make up to 2 claims in 3 years of insurance in a row, and this won't affect the NCD on this policy."
30,What are the benefits of Protected NCD?,The main benefit of Protected NCD is that it allows the policyholder to protect their NCD in case they make a claim. This can be valuable for drivers who have a good driving record and want to avoid losing their NCD.
31,Where does the car insurance policy apply?,"The car insurance policy applies in Great Britain, Northern Ireland, the Channel Islands, and the Isle of Man."
31,What is not covered in the Republic of Ireland?,"Motor Legal Cover, courtesy cars, and Guaranteed Hire Car Plus are not covered in the Republic of Ireland."
31,How can you extend your cover to other countries in Europe?,You can add Foreign Use Extension to your policy to extend your cover to the countries listed in the 'Countries where you have minimum cover'.
32,What is the level of cover under 'Liability to other people (third parties)' in section 1?,"You’ll have the same level of cover under ‘Liability to other people (third parties)’ in section 1 (excluding any cover the main driver has when driving another car) and sections 2, 4 and 5 as you have within the territorial limits in the countries listed in the ‘Countries where you have minimum cover’ section for up to 90 days in every insured period."
32,What is covered in the rest of Europe?,"The cover you have in the rest of Europe will also cover:

>Crossings between countries where your car is being transported by a recognised carrier.
>Any customs duty you need to pay on your car because of repairs that are covered by the policy."
32,What is not covered in the rest of Europe?,"You’re not covered in the rest of Europe

8If your cover includes Motor Legal Cover, this part of your cover doesn’t apply outside the territorial limits, apart from for road traffic accident claims.
8If anyone is driving a car other than your car.
8If you have a courtesy car, it cannot be used outside the territorial limits.
8If you have Guaranteed Hire Car Plus, and you have been provided with a hire car, this policy doesn’t give you cover to drive outside the territorial limits. Please check with the company that we instruct to give you the hire car to see if you are covered by their insurance."
33,What situations does the insurance policy not cover losses for?,"The insurance policy does not cover losses that occur while the car is being driven by someone who is not named or listed as excluded as a driver on the certificate of motor insurance or car insurance details, or if the car is being used for a purpose that is not shown as allowed on the certificate of motor insurance or car insurance details."
33,What specific conditions related to the driver can result in the policy not covering losses?,"The policy will not cover losses if the car is driven by someone who does not have a valid driving license, is disqualified from holding or obtaining a driving license, or is breaking the conditions of their driving license."
33,In what circumstances will the policy cover losses or damage to the car even if it is being driven without permission?,The policy will cover losses or damage to the car even if it is being driven without permission if the incident has been reported to the police and a crime reference number has been provided.
35,What are the exclusions for pressure waves?,We don’t cover any damage caused by pressure waves from an aircraft or other flying object travelling at or beyond the speed of sound.
35,What are the exclusions for automated cars?,"We won’t cover any loss, damage or injury caused by your automated car driving itself at any time or place that the use of automated functions is unlawful.
Unless we’re required to do so under the law of the country in which the accident occurs, we won’t cover any loss, damage or injury:
• To the person in charge of your automated car where the accident was wholly due to that person’s negligence in allowing your automated car to begin driving itself when it was not appropriate to do so.
• To an insured person if the accident is caused by a failure to install safety critical updates to your automated car or its software has been altered without the approval of the manufacturer. We may also require an insured person to repay us any amounts that we are required by law to pay."
35,What are the exclusions for cyber?,"We don’t cover any loss, damage, legal liability, cost or expense caused by: 
• Failure, or partial failure of any computer or computer system.
• Loss or partial loss of any electronic data.
• Repair, replacement or restoration of any electronic data.
• A cyber event."
36,What are the consequences of not providing accurate information or informing about changes?,"If you don’t provide correct and complete information or inform us of any changes, this could invalidate your policy, increase your premium or mean we don’t pay claims in full or at all."
36,What is considered a modification to your car?,"Modifications are changes to your car’s standard specification, including optional extras."
36,What happens if fraud is discovered?,"If we discover fraud, we have the right to: Cancel any other products you hold with U K Insurance Limited. Cancel this policy, if the fraud happened under any other policy you hold with U K Insurance Limited. Share information about your behaviour with other organisations to prevent further fraud. We may also involve the relevant authorities who can bring criminal proceedings."
37,What does the policy cover?,"The policy covers anyone insured to drive your car as part of a car sharing arrangement (carrying passengers for payment), provided that the car isn't made or adapted to carry more than 8 passengers and a driver, you're not carrying the passengers as part of a business, you're not making a profit from the passengers' payments or from allowing someone to drive, and you're not renting your car out or using a peer-to-peer hire scheme to do so."
37,When is the insurance company entitled to act on your behalf?,"The insurance company is entitled to do either of the following: Take over and carry out the negotiation, defence or settlement of any claim in your name, or in the name of any other person covered by this policy; or Start legal proceedings in your name, or in the name of any other person connected to this policy. This can be for your benefit or our own benefit."
37,What changes must you tell the insurance company about before your cover starts?,"Before your cover starts, you must tell the insurance company if anything has changed since you received your quote, such as: Anything about your car changes; You or any other driver have any claims or convictions that you haven't already told us about; There are any changes to how your car is used, for example if you change from social, domestic and pleasure use to business use; There are any modifications made to your car (see ‘Modifications to your car’ on page 36); You want to add another driver to the policy, or make any other change to who can drive your car; or You want to change to a higher level of cover, for example from Third Party, Fire and Theft to Comprehensive."
38,What information must be disclosed before policy renewal?,"Any motoring convictions, endorsements, penalty points, fixed penalties (excluding parking penalties), speed camera offences or disqualifications. Any incidents, thefts or losses, even if they didn't claim or were not to blame. Any insurance cancelled by another insurer for fraud or misrepresentation."
38,What are the consequences of not providing correct and complete information or informing the insurer of any changes?,The policy could be invalidated or claims may not be paid in full or at all.
38,What are the options for changing the policy?,"Temporary or permanent changes can be made at any time during the year, but an administration fee and additional premium may apply."
39,What happens if you make a claim or use your Green Flag cover before the cancellation or removal of your policy?,You will not receive a refund for any car insurance premium or Green Flag breakdown cover premium.
39,What are the consequences of not paying the amounts due under a credit agreement after making a claim?,"The amount paid in settlement of your claim may be reduced by the amount you owe, or you may be asked to pay the full amount."
39,What are some reasons why the policy might be canceled?,"Failure to cooperate with the insurer, changes in circumstances that affect eligibility for motor insurance, threatening or abusive behavior, and suspected fraud."
40,What happens if you have not paid the amounts due to the company under (1) and (2) above?,"If you have not paid the amounts due to the company under (1) and (2) above, the company may reduce the amount that they pay in settlement of your claim by the amount that you owe them. Alternatively, they may write to you asking you for the full payment."
40,What is the No Claim Discount (NCD)?,The No Claim Discount (NCD) is a discount that the company gives you if you don't claim on your policy. The discount increases the longer you go without making a claim.
40,What happens if you can't send the company acceptable proof of your NCD?,"If you can't send the company acceptable proof of your NCD, they will remove the NCD years from your policy. If they gave you a discount for your NCD, this will also be removed which may increase the cost of your cover."
42,How can I make a complaint?,"You can make a complaint by calling 0800 051 0198 if you're in the UK or +44 (0) 141 349 0193 if you're outside the UK. You can also write to Customer Relations Manager, Churchill Court, Westmoreland Road, Bromley BR1 1DP."
42,What will happen if my complaint can't be resolved within three working days?,"If your complaint can't be resolved within three working days, we'll contact you to let you know who'll be dealing with it, and what the next steps are. We'll keep you updated regularly."
42,What is the Financial Ombudsman Service?,The Financial Ombudsman Service (FOS) is an independent service that can help you resolve complaints about financial products and services.
43,What is the Financial Ombudsman Service (FOS)?,The Financial Ombudsman Service (FOS) is a free and independent service that can investigate complaints about financial businesses.
43,How can I contact the FOS?,"You can contact the FOS by email (complaint.info@financial-ombudsman.org.uk), phone (UK: 0300 123 9123 or 0800 023 4567, Abroad: +44 (0) 20 7964 0500), or by writing to Financial Ombudsman Service, Exchange Tower, London E14 9SR."
43,What is the process for making a complaint to the FOS?,"To make a complaint to the FOS, you should contact them within 6 months of receiving the response letter from the financial business that you are complaining about. The FOS will then investigate your complaint and make a decision."
